URL Source,Article,Summary
https://www.bbc.com/gujarati/india-44436218,"જોકે, રાજપૂતાના રાઇફલ્સની બીજી બટાલિયનમાં જોડાયેલા લેફ્ટનન્ટ હિતેશ કુમારના પિતા લાન્સ નાયક બચન સિંહ તેમના પુત્રની આ સફળતા જોવા હયાત નથી. 12 જૂન, 1999ના રોજ કારગિલ યુદ્ધમાં તોલોલિંગ પહાડી પર કબજો મેળવવા માટે થયેલી એ ભીષણ લડાઈમાં બચન સિંહે જીવ ગુમાવ્યો હતો. એ સમયે માત્ર છ વર્ષના તેમના પુત્ર હિતેશ કુમારને જીવનનું એક લક્ષ્ય આપ્યું - મોટા થઈને પિતાની જેમ જ ભારતીય સૈન્યમાં જોડાવવું. 19 વર્ષ બાદ હવે હિતેશ કુમાર દેહરાદૂનની ઇન્ડિયન મિલિટરી એકૅડેમીમાંથી તાલીમ બાદ લેફ્ટનન્ટ બનીને ભારતીય સૈન્યમાં જોડાયા હતા. એટલું જ નહીં તેમની નિમણૂક પણ તેમના પિતા લાન્સ નાયક બચન સિંહ જે બટાલિયનમાં હતા તે રાજપૂતાના રાઇફલ્સની બટાલિયનમાં જ થઈ હતી. માતાનું સપનું સાકાર થયું હિતેશ કુમારે પોતાના વિશે વાત કરતા બીબીસી ગુજરાતીને કહ્યું, ""મેં છેલ્લાં 19 વર્ષથી માત્ર સેનામાં જોડાવવાનું સપનું જોયું હતું."" ""મારી માતાનું પણ એ જ સપનું હતું અને હવે તે પૂર્ણ થયું છે. હું નિષ્ઠા અને ઈમાનદારીથી દેશની સેવા કરીશ."" દેહરાદૂન સ્થિત મિલિટરી એકૅડેમીમાંથી હિતેશ કુમારે પાસઆઉટ પરેડ બાદ પોતાના જિલ્લા મુઝફ્ફરનગરના સિવિલ લાઇન્સ વિસ્તારમાં આવેલી તેમના પિતા બચન સિંહની પ્રતિમાને શ્રદ્ધાંજલિ આપી હતી. હિતેશ કુમારે વધુમાં જણાવ્યું હતું કે તેઓ પિતાની જેમ જ દેશસેવા કરવા માગે છે. એ વાત તેમના માટે ગર્વની વાત છે કે તેઓ પિતાની બટાલિયનમાં જ જોડાયા છે. તેમણે માતાનો આભાર માનતા કહ્યું કે તેમની માતાના સંઘર્ષ અને પ્રાર્થનાને કારણે જ તેમને સફળતા મળી છે. હિતેશ કુમારે બીબીસીને જણાવ્યું કે ઋષિપાલ સિંહ તેમના મામા છે અને તેઓ પણ પિતાની બટાલિયનમાં સાથી રહી ચૂક્યા છે. ઋષિપાલ સિંહે બચન સિંહની બહાદુરીનાં વખાણ કરતાં જણાવ્યું હતું કે તેઓ એક નીડર સૈનિક હતા. ગુજરાતના એ ખેડૂતો જેમણે જાતમહેનતે સરોવર બાંધી દીધું હિતેશ કુમાર ઋષિપાલ સિંહે જૂની ઘટનાને વર્ણવતા કહ્યું હતું, ''દુશ્મનોએ કારગિલના તોલોલિંગ પર હુમલો કર્યો ત્યારે અમે 17 જવાન ગુમાવ્યા હતા. ''આ લડાઈમાં જવાન બચ્ચન સિંહના માથા પર ગોળી વાગી હતી. હિતેશની આ સિદ્ધિથી આજે પણ પિતાને ગર્વ થતો હશે.'' હિતેશનાં માતા કામેશ બાલાએ બીબીસી ગુજરાતીને જણાવ્યું હતું કે મારું એકમાત્ર સપનું હતું કે હિતેશ તેના પિતાની જેમ જ સૈન્યમાં જોડાય અને દેશની સેવા કરે. ""હવે એ સપનું પૂર્ણ થયું છે. આથી વધુ મારે કંઈ પણ જોઈતું નથી. પતિ શહીદ થયા બાદ જીવન ખૂબ જ સંઘર્ષમય બની ગયું હતું."" ""મેં મારું સંપૂર્ણ જીવન પુત્રના યોગ્ય ઉછેર માટે સમર્પિત કરી દીધું હતું. મને ગર્વ છે કે હિતેશની પસંદગી સેનામાં થઈ છે."" જ્યારે માતા પર મામાનો ફોન આવ્યો હિતેશ કુમારના પિતા બચન સિંહ અને માતા કામેશ બાલા જ્યારે દેશ માટે પિતાએ બલિદાન આપ્યું ત્યારે હિતેશ પરિવાર સાથે તેમના નાનાને ઘરે હતા. હિતેશ કુમાર જણાવે છે, ''હું, મારો ભાઈ અને મારી મમ્મી વૅકેશનમાં મારા નાના ઘરે ગયા હતા. હું અને મારો ભાઈ નીચે રમતાં હતા અને મારી માતા ઘરમાં કામ કરતી હતી.'' ''ત્યારે અચાનક મારા મામા ઋષિપાલ સિંહનો ફોન આવ્યો અને મારા પિતા શહીદ થયાની વાત મારી માતા સાથે કરી. તે સમયે સંપૂર્ણ પરિવાર શોકમગ્ન થઈ ગયો હતો.'' ''ત્યારબાદ અમે અમારા ઘરે પહોંચ્યા અને થોડા દિવસ બાદ મારા પિતાનો દેહ આવ્યો. દેહ સાથે અનેક સૈનિકો પણ આવ્યા હતા. બાદમાં અમારી જ જમીન પર પિતાજીનું સ્મારક બનાવ્યું હતું.'' પિતાની બટાલિયનમાં જજોડાયા માતા સાથે હિતેશ કુમાર જ્યારે હિતેશને પૂછવામાં આવ્યું કે દેશ માટે પોતાના પિતાએ જીવ ગુમાવ્યો ત્યારે પોતે પણ દેશની સેવા કરવાનો નિર્ણય ક્યારે કર્યો? ત્યારે તેમણે જવાબ આપ્યો કે મારી માતા અને મારું બંનેનું સપનું હતું કે હું સેનામાં સામેલ થઉ અને દેશની સેવા કરું. ''બાળપણમાં જ્યારે શાળામાં બધા વિદ્યાર્થીઓને પૂછવામાં આવ્યું કે તમે શુ બનવા માંગો છો તો ત્યારે મેં જવાબ આપ્યો કે 'સૈનિક'. ત્યારે અન્ય વિદ્યાર્થીઓ મારી સામે જોવા લાગ્યા હતા. ''ત્યારબાદ મેં શહીદ જવાનના પુત્રને આપવામાં આવતા પેરેન્ટલ ક્લેમનો ઉપયોગ કર્યો.'' ''પેરેન્ટલ ક્લેમ એટલે કોઈ જવાન શહીદ થાય તો તેના પુત્રને એ જ બટાલિયનમાં જોડાવાનો વિશેષ અધિકાર મળે છે. આથી મેં તેના થકી પિતાની જ બટાલિનમાં સ્થાન મેળવ્યું હતું'' કેક સમજી ગુલાબજાંબુ કાપી બર્થ-ડેની ઉજવણી માતા સાથે હિતેશ કુમાર બાળપણની વાતો યાદ કરતાં હિતેશ જણાવે છે કે પિતા જ્યારે પણ રજાઓમાં ઘરે આવતા હતા ત્યારે અમને તેઓ બહાર ફરવા અને જમવા માટે લઈ જતા હતા. એક બનાવને યાદ કરતાં તેઓ કહે છે કે ''એ વખતે અમારી ઉંમર ચાર-પાંચ વર્ષની હશે. હું અને મારો ભાઈ જોડિયા છીએ."" ""મારા પરિવારે અમારો જન્મદિવસ ઊજવવાની તૈયારી કરી હતી, ત્યારે મારા પિતા પણ ત્યાં હાજર હતા."" ''મારા માસીએ વિવિધ વાનગીઓ તૈયાર કરી હતી. આ સમયે નાની ઉંમર હોવાથી મેં ગુલાબજાંબુને કેક સમજી તેને કાપીને જન્મદિવસની ઉજવણી કરી હતી. ''એ સમયે ઘરમાં હળવો માહોલ સર્જાયો હતો.'' જ્યારે માતાએ પિતાનું સ્થાન લીધું સ્થાનિક ગઢરવાલોએ કારગિલમાં ઘૂસણખોરી વિશે માહિતી આપેલી તેમના જીવન વિશે હિતેશ જણાવે છે, ''પિતાના ગયા બાદ મારી માતાનું જીવન ખૂબ જ સંઘર્ષમય બની ગયું હતું. તેમણે અમને કોઈ મુશ્કેલી પડવા દીધી નહોતી.'' ''અમે બંને ભાઈઓમાં હું ખૂબ જ તોફાની હતો અને નાનો ભાઈ મારાથી શાંત હતો. માતા પાસે મારી અવારનવાર શાળાએથી ફરિયાદ આવતી હતી. ''મારી માતા પિતા કરતાં પણ ખૂબ જ કડક સ્વભાવનાં હતાં. તેઓ જરાક પણ ખોટું ચલાવી લેતાં નહોતાં.'' ''મમ્મીએ કેટલાક નિયમ બનાવ્યા હતા કે જેને અમારે અનુસરવા પડતા. જેમ કે, રાત્રે આઠ વાગ્યા પછી ઘરની બહાર ન નીકળવું.'' ''અમારે પૉકેટ મની જેવું કંઈ નહોતું, પરંતુ તેની બદલે અમારે જે પણ વસ્તુ જોઈએ એ સીધી માગી લેવાની હતી.'' શું હતી સમગ્ર ઘટના? પ્રતીકાત્મક તસવીર 1999ના યુદ્ધમાં રાજપૂતાના રાઇફલ્સની બીજી બટાલિયને તોલોલિંગને કબજે કર્યું હતું. કારગિલમાં મળેલી આ પ્રથમ સફળતા હતી, જે આગળની સફળતા માટે લૉન્ચિંગ પેડ સાબિત થઈ હતી. તોલોલિંગને ઘૂસણખોરોના કબજામાંથી મુક્ત કરાવવા માટે સેનાએ અનેક વખત પ્રયાસ કરવા પડ્યા હતા, જેમાં 100થી વધુ સૈનિકોનાં મૃત્યુ થયાં હતાં. અંતિમ હુમલામાં ચાર અધિકારી, બે જેસીઓ (જુનિયર કમિશન્ડ ઑફિસર) અને 17 સૈનિકોનાં મૃત્યુ થયાં હતાં અને 70 જવાન ઘાયલ થયા હતા. તમે અમને ફેસબુક, ઇન્સ્ટાગ્રામ, યૂટ્યૂબ અને ટ્વિટર પર ફોલો કરી શકો છો",હિતેશ કુમાર : સેનામાં જોડાવવાનું સપનું સાકાર કરનાર લેફ્ટનન્ટ હિતેશ કુમારના પિતાએ શું કર્યું?
https://www.bbc.com/gujarati/india-56384394,"સામાચાર એજન્સી એએનઆઈ પ્રમાણે આગ લાગવાની આ ઘટના શૉર્ટ સર્કિટના કારણે થઈ છે. જોકે, અધિકારીઓના જણાવ્યા પ્રમાણે આગ પર કાબુ મેળવી લેવાયો છે. Twitter કન્ટેન્ટ પૂર્ણ, 1 ઉત્તરાખંડના ડીજીપી અશોક કુમારે જણાવ્યું છે કે ઘટના કંસારો પાસે ઘટી હતી. બધા જ યાત્રીઓ સુરક્ષિત બહાર કઢાયા છે. અને હાલ કોઈ જાનહાનિના સમાચાર નથી. અમદાવાદના ક્લબ્સમાં નહીં થાય હોળીની ઉજવણી ભારતમાં કોરોના વાઇરસના કેસો સતત વધી રહ્યાં છે અને ગુજરાતમાં પણ કોરોના વાઇરસથી સંક્રમિત લોકોની સંખ્યામાં ચિંતાજનક વધારો જોવા મળી રહ્યો છે. આ દરમિયાન અમદાવાદના રાજપથ તેમજ કર્ણાવતી ક્લબે ધૂળેટીની ઉજવણી નહીં કરવાનો નિર્ણય લીધો છે. ટાઇમ્સ ઑફ ઇન્ડિયાના અહેવાલ અનુસાર સતત ચોથા વર્ષે ક્લબમાં હોળીની ઉજવણી નહીં થાય. કર્ણાવતી ક્લબના પ્રમુખ નગીનભાઈ પટેલે ટાઇમ્સ ઑફ ઇન્ડિયા સાથેની વાતચીતમાં જણાવ્યું છે, ""અમે 28 માર્ચે હોળીની ઉજવણી નહીં કરવાનો નિર્ણય લીધો છે. અમે અહીં કોઈ ઉજવણી નહીં કરીએ અને લોકોને ભેગા નહીં થવા દઈએ. આવું ત્યાં સુધી કરવામાં આવશે જ્યાં સુધી કોરોના વાઇરસના કેસોની સંખ્યા નિયંત્રણમાં ન આવે અને જેથી અમારા મહેમાનોના સ્વાસ્થ્યને કોઈ નુકસાન ન થાય."" આવું સતત ચોથા વર્ષે થઈ રહ્યું છે જ્યારે આ ક્લબમાં ધૂળેટીની ઉજવણી કરવામાં નહીં આવે. રાજપથ ક્લબના સેક્રેટરી મિશાલ પટેલે કહ્યું છે, ""છેલ્લા ત્રણ વર્ષથી પાણીની તંગી અને પછી કોરોના વાઇરસના કારણે અમે ધૂળેટીની ઉજવણી કરી નથી. આ વર્ષે પણ કોરોનાના વધતા કેસોના પગલે અમે કોઈ ઉજવણી કરવાના નથી."" શહેરના બીજા ક્લબમાં પણ કોરોના વાઇરસના કારણે હોળીની ઉજવણી રદ થઈ શકે છે. પેટ્રોલ-ડીઝલના ભાવ બાદ હવે મોંઘવારી પણ વધી છેલ્લા કેટલાક સમયથી પેટ્રોલ-ડીઝલના ભાવમાં સતત વધારો જોવા મળી રહ્યો છે. હવે તેની અસર મોંઘવારી ઉપર પણ જોવા મળી રહી છે. 'બિઝનેસ સ્ટાન્ડર્ડ'ના રિપોર્ટ મુજબ, ફેબ્રુઆરી મહિનામાં મોંઘવારીનો દર ત્રણ મહિનાની સર્વોચ્ચ સપાટી 5.03 ટકા ઉપર પહોંચી ગયો હતો. પેટ્રોલ-ડીઝલના ભાવ વધતા ખાદ્યપદાર્થોના ભાવ વધ્યા છે, જેની અસર મોંઘવારી ઉપર પડી રહી છે. જાન્યુઆરી મહિનામાં મોંઘવારીનો દર 4.06 ટકા હતો. જાન્યુઆરી મહિનામાં પેટ્રોલના ભાવોમાં 12.53 %નો વધારો જોવા મળ્યો હતો, જે ફેબ્રુઆરી મહિનામાં વધીને 20.57 ટકા ઉપર પહોંચી ગઈ. આવી જ રીતે ડીઝલની મોંઘવારી 12.79 ટકાથી વધીને 20.57 ટકા ઉપર પહોંચી છે. 2011 પછી જાહેર રસ્તા પર અથવા તેની આજુબાજુમાં બનેલાં ધાર્મિક બાંધકામને હઠાવવાનો યોગી સરકારનો આદેશ ઇન્ડિયન એક્સપ્રેસના અહેવાલ અનુસાર ઉત્તર પ્રદેશ સરકારે આદેશ આપ્યો છે કે 2011 પછી રસ્તાઓ પર, ફૂટપાથ કે તેની આસપાસમાં બનાવવામાં આવેલા ધાર્મિક પ્રકૃતિના તમામ બાંધકામને તાત્કાલિક ધોરણે દૂર કરી દેવામાં આવે. ઉત્તર પ્રદેશના ગૃહ વિભાગ દ્વારા આપવામાં આવેલા આદેશમાં કહેવામાં આવ્યું છે કે જાહેર રસ્તાઓ, શેરીઓ, ફૂટપાથ અને રસ્તાની બાજુમાં બનાવવામાં આવેલાં કોઈ પણ પ્રકારના ધાર્મિક પ્રકૃતિના બાંધકામને પરવાનગી હોવી ન જોઈએ. આ આદેશમાં કહેવામાં આવ્યું છે કે જો આવું કોઈ બાંધકામ 1 જાન્યુઆરી 2011ના રોજ કે તે પછી કરવામાં આવ્યું હોય તો તેને તાત્કાલિક ધોરણે હઠાવી દેવું જોઈએ. સરકારે હાઇકોર્ટના આદેશનું પાલન કરીને આ સૂચનો જાહેર કર્યા હોવાનું રીલિઝમાં કહેવાયું છે. જાહેરનામામાં જિલ્લાકક્ષાના વરિષ્ઠ અધિકારીઓને કહેવામાં આવ્યું છે કે જો 1 જાન્યુઆરી, 2011 પહેલા રાજમાર્ગ સહિતના જાહેર માર્ગ પર કોઈપણ ધાર્મિક બાંધકામ કે અતિક્રમણ કરવામાં આવ્યું હોત, તો તેને ધર્મના અનુયાયીઓ દ્વારા આપવામાં આવતી જમીન પર સ્થળાંતર થવું જોઈએ. CBIના વડા કોણ? સેન્ટ્રલ બ્યૂરો ઑફ ઇન્ડિયાના વડા તરીકે નેશનલ ઇન્વેસ્ટિગેશન એજન્સીના વડા વાય.સી. મોદી તથા રાકેશ અસ્થાનાના નામ અગ્રેસર છે. 'ધ ટેલિગ્રાફ' સૂત્રોને ટાંકતા જણાવે છે કે બંને અધિકારીને પ્રધાન મંત્રીની નજીક માનવામાં આવે છે. બે વર્ષના કાર્યકાળ બાદ ઋષિકુમાર શુકલા બીજી ફેબ્રુઆરીના નિવૃત્ત થયા હતા. હાલ પ્રવીણકુમાર સિંહા વચગાળાના વડા તરીકે ફરજ બજાવી રહ્યા છે. ડિપાર્ટમેન્ટ ઑફ પર્સોનલ ઍન્ડ ટ્રેનિંગ દ્વારા ગૃહવિભાગ પાસેથી 1984,1985 અને 1986ની બેચના આઈ.પી.એસ. અધિકારીના નામ મંગાવવામાં આવ્યા છે. કૉમન કોઝ નામની સ્વૈચ્છિક સંસ્થાએ સર્વોચ્ચ અદાલતમાં અરજી દાખલ કરીને માગ કરી છે કે તત્કાળ અસરથી નિયમિત સીબીઆઈ વડાની નિમણૂક કરવામાં આવે. અદાલતે આ મુદ્દે કેન્દ્ર સરકારને નોટિસ કાઢી છે અને 15 દિવસમાં જવાબ આપવા જણાવ્યું છે. ઉપરોક્ત બંને અધિકારી ઉપરાંત ગુજરાત કૅડરના અધિકારી કેશવ કુમાર તથા ખુદ પ્રવીણ સિંહાના નામ અગ્રેસર હોવાનું અખબાર નોંધે છે. ઉલ્લેખનીય છે કે દેશના પ્રધાન મંત્રી, સુપ્રીમ કોર્ટના સર્વોચ્ચ ન્યાયાધીશ તથા સૌથી મોટા વિરોધપક્ષના નેતા કે તેમના પ્રતિનિધિ મળીને કોઈ નામ ઉપર મંજૂરીની મહોર મારે છે અને કેન્દ્રીય કૅબિનેટ દ્વારા તેની ઉપર મંજૂરીની મહોર મારવામાં આવે છે. તમે અમને ફેસબુક, ઇન્સ્ટાગ્રામ, યૂટ્યૂબ અને ટ્વિટર પર ફોલો કરી શકો છો",કોરોના વાઇરસ : ઉત્તરાખંડના રાજપથ ક્લબમાં હોળીની ઉજવણી નહીં થાય
